{
  "name": "3x3 Grid Shortest-Path",
  "topologyType": "custom",
  "isDirected": false,
  "nodes": [
    { "id": "n11", "label": "1,1", "x": 100, "y": 100 },
    { "id": "n12", "label": "1,2", "x": 250, "y": 100 },
    { "id": "n13", "label": "1,3", "x": 400, "y": 100 },
    { "id": "n21", "label": "2,1", "x": 100, "y": 250 },
    { "id": "n22", "label": "2,2", "x": 250, "y": 250 },
    { "id": "n23", "label": "2,3", "x": 400, "y": 250 },
    { "id": "n31", "label": "3,1", "x": 100, "y": 400 },
    { "id": "n32", "label": "3,2", "x": 250, "y": 400 },
    { "id": "n33", "label": "3,3", "x": 400, "y": 400 }
  ],
  "links": [
    { "id": "n11-n12", "source": "n11", "target": "n12", "weight": 1, "capacity": 10 },
    { "id": "n12-n13", "source": "n12", "target": "n13", "weight": 1, "capacity": 10 },
    { "id": "n21-n22", "source": "n21", "target": "n22", "weight": 1, "capacity": 10 },
    { "id": "n22-n23", "source": "n22", "target": "n23", "weight": 1, "capacity": 10 },
    { "id": "n31-n32", "source": "n31", "target": "n32", "weight": 1, "capacity": 10 },
    { "id": "n32-n33", "source": "n32", "target": "n33", "weight": 1, "capacity": 10 },
    { "id": "n11-n21", "source": "n11", "target": "n21", "weight": 1, "capacity": 10 },
    { "id": "n21-n31", "source": "n21", "target": "n31", "weight": 1, "capacity": 10 },
    { "id": "n12-n22", "source": "n12", "target": "n22", "weight": 1, "capacity": 10 },
    { "id": "n22-n32", "source": "n22", "target": "n32", "weight": 1, "capacity": 10 },
    { "id": "n13-n23", "source": "n13", "target": "n23", "weight": 1, "capacity": 10 },
    { "id": "n23-n33", "source": "n23", "target": "n33", "weight": 1, "capacity": 10 }
  ],
  "demands": [
    { "id": "d1", "source": "n11", "target": "n33", "amount": 4 }
  ]
}
