{
  "name": "Random Medium Network (10 nodes, 18 links)",
  "topologyType": "custom",
  "isDirected": false,
  "nodes": [
    { "id": "R1",  "label": "R1",  "x":  80, "y": 160 },
    { "id": "R2",  "label": "R2",  "x": 220, "y":  60 },
    { "id": "R3",  "label": "R3",  "x": 380, "y":  60 },
    { "id": "R4",  "label": "R4",  "x": 520, "y": 160 },
    { "id": "R5",  "label": "R5",  "x": 520, "y": 300 },
    { "id": "R6",  "label": "R6",  "x": 380, "y": 400 },
    { "id": "R7",  "label": "R7",  "x": 220, "y": 400 },
    { "id": "R8",  "label": "R8",  "x":  80, "y": 300 },
    { "id": "R9",  "label": "R9",  "x": 220, "y": 230 },
    { "id": "R10", "label": "R10", "x": 380, "y": 230 }
  ],
  "links": [
    { "id": "R1-R2",  "source": "R1",  "target": "R2",  "weight": 1, "capacity": 10 },
    { "id": "R2-R3",  "source": "R2",  "target": "R3",  "weight": 1, "capacity": 10 },
    { "id": "R3-R4",  "source": "R3",  "target": "R4",  "weight": 1, "capacity": 10 },
    { "id": "R4-R5",  "source": "R4",  "target": "R5",  "weight": 1, "capacity": 10 },
    { "id": "R5-R6",  "source": "R5",  "target": "R6",  "weight": 1, "capacity": 10 },
    { "id": "R6-R7",  "source": "R6",  "target": "R7",  "weight": 1, "capacity": 10 },
    { "id": "R7-R8",  "source": "R7",  "target": "R8",  "weight": 1, "capacity": 10 },
    { "id": "R8-R1",  "source": "R8",  "target": "R1",  "weight": 1, "capacity": 10 },
    { "id": "R9-R10", "source": "R9",  "target": "R10", "weight": 1, "capacity": 10 },
    { "id": "R1-R9",  "source": "R1",  "target": "R9",  "weight": 1, "capacity": 10 },
    { "id": "R2-R9",  "source": "R2",  "target": "R9",  "weight": 1, "capacity": 10 },
    { "id": "R3-R10", "source": "R3",  "target": "R10", "weight": 1, "capacity": 10 },
    { "id": "R4-R10", "source": "R4",  "target": "R10", "weight": 1, "capacity": 10 },
    { "id": "R5-R10", "source": "R5",  "target": "R10", "weight": 1, "capacity": 10 },
    { "id": "R6-R10", "source": "R6",  "target": "R10", "weight": 1, "capacity": 10 },
    { "id": "R7-R9",  "source": "R7",  "target": "R9",  "weight": 1, "capacity": 10 },
    { "id": "R8-R9",  "source": "R8",  "target": "R9",  "weight": 1, "capacity": 10 },
    { "id": "R1-R7",  "source": "R1",  "target": "R7",  "weight": 1, "capacity": 10 }
  ],
  "demands": [
    { "id": "d1", "source": "R1",  "target": "R5",  "amount": 3 },
    { "id": "d2", "source": "R2",  "target": "R6",  "amount": 2 },
    { "id": "d3", "source": "R3",  "target": "R7",  "amount": 4 },
    { "id": "d4", "source": "R8",  "target": "R4",  "amount": 1.5 }
  ]
}
